Player, Pos, Team, Salary, GP, FPPG, FPMAX, Floor, Ceil, %2x, %3x, %4x, %5x, %6x
Ty Lawson, PG, IND, 3500.00, 8, 14.41, 16.3, 12.64, 16.19, 100.0, 87.5, 75.0, 0.0, 0.0 
Alonzo Gee, SF, NOP, 3700.00, 7, 15.74, 29.6, 8.63, 22.86, 100.0, 57.14, 42.86, 28.57, 14.29 
J.R. Smith, SG, CLE, 4500.00, 11, 19.81, 38.5, 9.95, 29.66, 90.91, 63.64, 63.64, 36.36, 18.18 
Jeremy Lin, SG, CHA, 4200.00, 9, 23.29, 39.4, 13.28, 33.3, 100.0, 77.78, 66.67, 55.56, 55.56 
Brandon Jennings, PG, ORL, 4100.00, 10, 15.65, 24.4, 10.59, 20.71, 100.0, 80.0, 40.0, 20.0, 0.0 
Avery Bradley, SG, BOS, 5800.00, 8, 29, 39.6, 22.82, 35.18, 100.0, 100.0, 62.5, 50.0, 25.0 
Mo Williams, PG, CLE, 3500.00, 5, 8.3, 15.4, 4.07, 12.53, 40.0, 40.0, 20.0, 0.0, 0.0 
Ramon Sessions, PG, WAS, 3700.00, 10, 10.62, 26, 3.26, 17.98, 70.0, 30.0, 30.0, 10.0, 10.0 
George Hill, PG, IND, 4700.00, 10, 21.33, 40.1, 13.46, 29.2, 100.0, 90.0, 60.0, 30.0, 10.0 
Arron Afflalo, SG, NYK, 4100.00, 10, 15.72, 31.1, 6.75, 24.69, 80.0, 40.0, 30.0, 30.0, 30.0 
Randy Foye, SG, OKC, 3500.00, 10, 11.34, 22.9, 3.95, 18.73, 60.0, 40.0, 40.0, 30.0, 20.0 
Wayne Ellington, SG, BKN, 3500.00, 6, 12.32, 17.7, 7.95, 16.68, 83.33, 66.67, 50.0, 16.67, 0.0 
C.J. Watson, PG, ORL, 3500.00, 6, 9.74, 17.1, 3.5, 15.98, 50.0, 33.33, 33.33, 0.0, 0.0 
Gerald Henderson, SG, POR, 3800.00, 11, 18.48, 28.5, 13.2, 23.77, 100.0, 100.0, 54.55, 36.36, 18.18 
Marcus Thornton, SG, WAS, 3500.00, 6, 14.35, 28.9, 5.54, 23.16, 83.33, 50.0, 33.33, 33.33, 33.33 
Courtney Lee, SG, CHA, 4300.00, 10, 21.91, 29.7, 16.29, 27.53, 100.0, 90.0, 70.0, 50.0, 30.0 
Steve Blake, PG, DET, 3500.00, 10, 11.81, 16.6, 9.02, 14.6, 100.0, 70.0, 20.0, 0.0, 0.0 
J.J. Redick, SG, LAC, 4600.00, 9, 19.28, 28.9, 14.2, 24.35, 100.0, 100.0, 33.33, 22.22, 11.11 
James Harden, SG, HOU, 10900.00, 9, 53.29, 62.3, 45.51, 61.07, 100.0, 100.0, 88.89, 44.44, 0.0 
Toney Douglas, PG, NOP, 5600.00, 11, 24.22, 36.6, 17.15, 31.29, 100.0, 81.82, 63.64, 27.27, 18.18 
Louis Williams, SG, LAL, 4600.00, 7, 20.14, 39.1, 11.33, 28.96, 100.0, 71.43, 42.86, 14.29, 14.29 
Rodney Stuckey, SG, IND, 3800.00, 10, 12.27, 27.7, 4.88, 19.66, 80.0, 50.0, 20.0, 20.0, 10.0 
Jason Terry, PG, HOU, 3500.00, 9, 6.1, 13.3, 2.52, 9.68, 33.33, 11.11, 0.0, 0.0, 0.0 
Jose Calderon, PG, NYK, 4100.00, 8, 18.58, 30.9, 8.61, 28.54, 75.0, 75.0, 50.0, 50.0, 37.5 
Jamal Crawford, SG, LAC, 4900.00, 10, 22.93, 46.7, 12.07, 33.79, 90.0, 80.0, 50.0, 40.0, 30.0 
Devin Harris, SG, DAL, 3900.00, 8, 18.1, 28.1, 10, 26.2, 87.5, 62.5, 62.5, 37.5, 37.5 
Raymond Felton, PG, DAL, 4700.00, 8, 19.81, 31.5, 10.24, 29.39, 75.0, 75.0, 50.0, 50.0, 37.5 
Deron Williams, PG, DAL, 6100.00, 3, 38.33, 59.6, 22.83, 53.83, 100.0, 100.0, 66.67, 66.67, 33.33 
Kobe Bryant, SG, LAL, 5400.00, 8, 21.45, 46.3, 8.61, 34.29, 62.5, 62.5, 50.0, 25.0, 12.5 
Russell Westbrook, PG, OKC, 10700.00, 10, 48.64, 57.1, 42.06, 55.22, 100.0, 100.0, 80.0, 40.0, 0.0 
John Wall, PG, WAS, 9400.00, 10, 42.62, 51.6, 36.53, 48.71, 100.0, 100.0, 80.0, 30.0, 0.0 
Chris Paul, PG, LAC, 9700.00, 9, 43.39, 57.7, 34.9, 51.87, 100.0, 100.0, 66.67, 33.33, 0.0 
Monta Ellis, SG, IND, 6100.00, 10, 25.49, 46.7, 15.47, 35.51, 90.0, 70.0, 70.0, 30.0, 10.0 
Carmelo Anthony, SF, NYK, 8500.00, 8, 35.81, 43.4, 30.28, 41.34, 100.0, 100.0, 50.0, 25.0, 0.0 
Jonas Jerebko, PF, BOS, 3500.00, 7, 12.1, 17.9, 7.45, 16.75, 85.71, 71.43, 42.86, 14.29, 0.0 
James Jones, SF, CLE, 3500.00, 5, 8.96, 13.2, 6.63, 11.29, 80.0, 20.0, 0.0, 0.0, 0.0 
Richard Jefferson, SF, CLE, 3500.00, 8, 9.8, 28.3, 2.41, 17.19, 50.0, 25.0, 12.5, 12.5, 12.5 
Luke Babbitt, SF, NOP, 5000.00, 11, 20.88, 41.5, 9.3, 32.46, 72.73, 63.64, 63.64, 45.45, 18.18 
LeBron James, SF, CLE, 10600.00, 10, 48.64, 66.7, 37.53, 59.75, 100.0, 100.0, 70.0, 40.0, 10.0 
Paul George, SF, IND, 8900.00, 10, 39.85, 61.4, 30.04, 49.66, 100.0, 90.0, 60.0, 30.0, 10.0 
Lou Amundson, PF, NYK, 3500.00, 4, 4.63, 8.9, 1, 8.25, 50.0, 0.0, 0.0, 0.0, 0.0 
Dante Cunningham, PF, NOP, 3900.00, 11, 17.99, 30.2, 12.27, 23.71, 100.0, 81.82, 72.73, 36.36, 9.09 
Anthony Tolliver, PF, DET, 3500.00, 9, 9.73, 24.8, 1.6, 17.87, 44.44, 33.33, 22.22, 22.22, 22.22 
Ed Davis, PF, POR, 4600.00, 11, 24, 32.8, 17.64, 30.36, 100.0, 90.91, 81.82, 45.45, 36.36 
Jordan Hill, C, IND, 3500.00, 8, 13.09, 27.7, 5.45, 20.72, 87.5, 50.0, 25.0, 25.0, 25.0 
Corey Brewer, SF, HOU, 3500.00, 9, 10.53, 18, 4.6, 16.45, 66.67, 44.44, 33.33, 22.22, 0.0 
Al-Farouq Aminu, SF, POR, 5400.00, 11, 25.65, 47.3, 16.81, 34.48, 100.0, 90.91, 63.64, 36.36, 18.18 
Wesley Johnson, SF, LAC, 3700.00, 10, 14.37, 26.3, 7.77, 20.97, 80.0, 70.0, 50.0, 20.0, 20.0 
Ryan Anderson, PF, NOP, 6100.00, 2, 41.7, 44.9, 38.5, 44.9, 100.0, 100.0, 100.0, 100.0, 100.0 
Amir Johnson, PF, BOS, 4600.00, 9, 24.58, 39.3, 15.85, 33.3, 100.0, 77.78, 66.67, 55.56, 44.44 
Evan Turner, SF, BOS, 6100.00, 9, 29.4, 39.3, 21.61, 37.19, 100.0, 88.89, 77.78, 55.56, 11.11 
Serge Ibaka, PF, OKC, 5500.00, 8, 26.01, 33.1, 20.12, 31.91, 100.0, 87.5, 75.0, 50.0, 12.5 
Tyler Hansbrough, PF, CHA, 3500.00, 4, 4.33, 8.6, 1.21, 7.46, 25.0, 0.0, 0.0, 0.0, 0.0 
C.J. Miles, SF, IND, 3800.00, 10, 16.11, 33.4, 8.5, 23.72, 90.0, 80.0, 40.0, 30.0, 20.0 
Ersan Ilyasova, PF, ORL, 3900.00, 4, 16.6, 24.3, 11.99, 21.21, 100.0, 100.0, 50.0, 25.0, 25.0 
Anthony Morrow, SG, OKC, 3500.00, 8, 6.6, 10.5, 4.64, 8.56, 37.5, 12.5, 0.0, 0.0, 0.0 
Charlie Villanueva, PF, DAL, 3500.00, 6, 11.34, 25, 4.36, 18.32, 66.67, 16.67, 16.67, 16.67, 16.67 
Jeff Green, SF, LAC, 4200.00, 9, 19.1, 30.6, 10.37, 27.83, 88.89, 77.78, 55.56, 55.56, 33.33 
Nicolas Batum, SF, CHA, 7600.00, 9, 34.02, 50.4, 22.29, 45.76, 88.89, 88.89, 66.67, 33.33, 33.33 
Marvin Williams, PF, CHA, 5600.00, 9, 22.51, 37.1, 13.89, 31.13, 100.0, 66.67, 44.44, 22.22, 22.22 
Jared Dudley, PF, WAS, 3500.00, 10, 9.98, 22.6, 4.69, 15.27, 70.0, 40.0, 10.0, 10.0, 10.0 
Trevor Ariza, SF, HOU, 5600.00, 9, 23.26, 33.6, 16.61, 29.9, 100.0, 77.78, 55.56, 33.33, 11.11 
Michael Beasley, SF, HOU, 5300.00, 9, 24.28, 35.8, 15.14, 33.41, 88.89, 77.78, 55.56, 44.44, 33.33 
Wesley Matthews, SG, DAL, 5100.00, 9, 25.46, 35.5, 18.84, 32.08, 100.0, 88.89, 77.78, 44.44, 22.22 
Paul Pierce, SF, LAC, 3500.00, 6, 13.15, 20.4, 9.11, 17.19, 100.0, 66.67, 33.33, 16.67, 0.0 
Dirk Nowitzki, PF, DAL, 7100.00, 8, 31.51, 57.6, 18.08, 44.94, 100.0, 62.5, 50.0, 25.0, 25.0 
Kevin Love, PF, CLE, 7000.00, 10, 30.77, 45.4, 20.14, 41.4, 90.0, 90.0, 60.0, 40.0, 20.0 
Kevin Durant, SF, OKC, 10500.00, 9, 48.17, 65.6, 39.29, 57.05, 100.0, 100.0, 88.89, 22.22, 11.11 
Ian Mahinmi, C, IND, 5200.00, 9, 24.96, 38.2, 17.47, 32.44, 100.0, 88.89, 77.78, 33.33, 22.22 
Joel Anthony, C, DET, 3500.00, 1, 1.2, 1.2, 1.2, 1.2, 0.0, 0.0, 0.0, 0.0, 0.0 
J.J. Hickson, PF, WAS, 3500.00, 4, 12.83, 22, 4.33, 21.34, 50.0, 50.0, 50.0, 25.0, 25.0 
Kendrick Perkins, C, NOP, 3500.00, 11, 10.66, 19.4, 6.64, 14.68, 81.82, 45.45, 18.18, 9.09, 0.0 
Cole Aldrich, C, LAC, 3500.00, 10, 15.11, 24, 9.9, 20.32, 90.0, 90.0, 50.0, 50.0, 10.0 
Chris Kaman, C, POR, 3500.00, 4, 6.65, 20.5, -1.36, 14.66, 25.0, 25.0, 25.0, 25.0, 0.0 
Kevin Seraphin, PF, NYK, 3600.00, 9, 13.61, 20.4, 7.76, 19.46, 88.89, 66.67, 44.44, 33.33, 0.0 
Timofey Mozgov, C, CLE, 3500.00, 11, 13.12, 21.4, 8.76, 17.47, 90.91, 72.73, 36.36, 18.18, 9.09 
Zaza Pachulia, C, DAL, 3600.00, 8, 12.84, 30.1, 3.23, 22.45, 62.5, 62.5, 37.5, 25.0, 25.0 
Omer Asik, C, NOP, 3500.00, 10, 13.14, 31.8, 3.69, 22.59, 60.0, 60.0, 40.0, 40.0, 10.0 
Nick Collison, PF, OKC, 3500.00, 3, 7.73, 10.3, 4.52, 10.95, 66.67, 0.0, 0.0, 0.0, 0.0 
Robin Lopez, C, NYK, 5900.00, 10, 26.35, 51, 13.01, 39.69, 90.0, 70.0, 50.0, 30.0, 30.0 
Jason Smith, PF, ORL, 3700.00, 10, 17.74, 26.5, 11.47, 24.02, 80.0, 80.0, 50.0, 50.0, 20.0 
Spencer Hawes, C, CHA, 3800.00, 5, 11.8, 23.8, 5.21, 18.39, 60.0, 40.0, 20.0, 20.0, 20.0 
Brandon Bass, PF, LAL, 3800.00, 7, 16.17, 28.7, 9.44, 22.9, 85.71, 85.71, 57.14, 28.57, 14.29 
Marcin Gortat, C, WAS, 6400.00, 10, 29.93, 38.3, 25.02, 34.84, 100.0, 100.0, 80.0, 40.0, 0.0 
Channing Frye, PF, CLE, 3500.00, 11, 12.72, 24.6, 4.8, 20.63, 63.64, 54.55, 36.36, 36.36, 27.27 
JaVale McGee, C, DAL, 3500.00, 1, 4.4, 4.4, 4.4, 4.4, 0.0, 0.0, 0.0, 0.0, 0.0 
DeAndre Jordan, C, LAC, 8300.00, 9, 35.99, 51.5, 27.03, 44.95, 100.0, 100.0, 44.44, 22.22, 11.11 
Roy Hibbert, C, LAL, 4000.00, 9, 16.3, 32.3, 8.11, 24.49, 88.89, 66.67, 44.44, 33.33, 11.11 
Al Jefferson, C, CHA, 5000.00, 9, 23.47, 35.5, 17.94, 29, 100.0, 88.89, 77.78, 22.22, 11.11 
David Lee, PF, DAL, 4200.00, 9, 17.68, 36.2, 7.6, 27.76, 88.89, 66.67, 33.33, 33.33, 22.22 
Dwight Howard, C, HOU, 6500.00, 9, 26.24, 35.6, 19.09, 33.4, 88.89, 77.78, 66.67, 22.22, 0.0 
Blake Griffin, PF, LAC, 8600.00, 2, 13.55, 17, 10.1, 17, 0.0, 0.0, 0.0, 0.0, 0.0 
Nikola Vucevic, C, ORL, 8000.00, 3, 38.17, 44.5, 33.56, 42.77, 100.0, 100.0, 100.0, 33.33, 0.0 
Donatas Motiejunas, PF, HOU, 3500.00, 9, 15.58, 34.3, 6.96, 24.2, 77.78, 77.78, 55.56, 22.22, 22.22 
Enes Kanter, C, OKC, 5300.00, 10, 24.86, 34, 19, 30.72, 100.0, 90.0, 70.0, 40.0, 20.0 
Derrick Williams, PF, NYK, 3700.00, 10, 15.97, 24.6, 9.82, 22.12, 90.0, 80.0, 50.0, 50.0, 20.0 
Tristan Thompson, PF, CLE, 4600.00, 11, 22.65, 40.5, 13.09, 32.2, 90.91, 90.91, 54.55, 54.55, 36.36 
Jordan Hamilton, SF, NOP, 4600.00, 6, 23.8, 30.4, 19, 28.6, 100.0, 100.0, 83.33, 50.0, 33.33 
Markieff Morris, PF, WAS, 5500.00, 9, 26.22, 43.3, 17, 35.44, 88.89, 88.89, 66.67, 44.44, 22.22 
Marcus Morris, SF, DET, 6200.00, 10, 29.11, 57.4, 16.61, 41.61, 90.0, 80.0, 80.0, 40.0, 10.0 
Chandler Parsons, SF, DAL, 6800.00, 1, 22.6, 22.6, 22.6, 22.6, 100.0, 100.0, 0.0, 0.0, 0.0 
Kyle Singler, SF, OKC, 3500.00, 7, 7.62, 12.8, 3.38, 11.85, 57.14, 28.57, 0.0, 0.0, 0.0 
Lavoy Allen, PF, IND, 3500.00, 10, 10.46, 32.2, 2.17, 18.75, 50.0, 40.0, 30.0, 10.0, 10.0 
Tobias Harris, PF, DET, 6400.00, 10, 30.03, 40.5, 23.8, 36.26, 100.0, 100.0, 70.0, 30.0, 20.0 
Kyrie Irving, PG, CLE, 7200.00, 9, 28.98, 44.7, 18.52, 39.44, 88.89, 77.78, 44.44, 33.33, 22.22 
Kemba Walker, PG, CHA, 8100.00, 10, 32.18, 52.7, 20.48, 43.88, 90.0, 80.0, 50.0, 20.0, 10.0 
Isaiah Thomas, PG, BOS, 7700.00, 9, 34, 46.2, 27.52, 40.48, 100.0, 100.0, 55.56, 22.22, 11.11 
Andrew Goudelock, PG, HOU, 3500.00, 1, 6.7, 6.7, 6.7, 6.7, 0.0, 0.0, 0.0, 0.0, 0.0 
Iman Shumpert, SG, CLE, 3700.00, 11, 14.59, 22.6, 9.07, 20.11, 90.91, 72.73, 54.55, 36.36, 9.09 
Reggie Jackson, PG, DET, 5900.00, 10, 26.56, 35.9, 21.46, 31.66, 100.0, 100.0, 60.0, 40.0, 10.0 
Donald Sloan, PG, BKN, 3600.00, 9, 14.66, 23.5, 7.33, 21.98, 77.78, 66.67, 55.56, 55.56, 11.11 
Alan Anderson, SG, WAS, 3500.00, 1, 7.1, 7.1, 7.1, 7.1, 100.0, 0.0, 0.0, 0.0, 0.0 
Dion Waiters, SG, OKC, 3500.00, 10, 17.15, 34.7, 5.66, 28.64, 70.0, 70.0, 50.0, 40.0, 40.0 
Bradley Beal, SG, WAS, 5800.00, 9, 25.94, 38.3, 18.15, 33.74, 88.89, 77.78, 77.78, 44.44, 11.11 
Thomas Robinson, PF, BKN, 6000.00, 7, 22.74, 41.1, 10.14, 35.34, 71.43, 57.14, 57.14, 28.57, 28.57 
Damian Lillard, PG, POR, 8000.00, 11, 35.05, 49.6, 26.1, 44.01, 100.0, 81.82, 63.64, 27.27, 9.09 
Austin Rivers, PG, LAC, 3900.00, 10, 19.74, 46.3, 9.48, 30, 100.0, 80.0, 60.0, 40.0, 40.0 
Andre Drummond, C, DET, 8000.00, 10, 36.19, 51.3, 29.1, 43.28, 100.0, 100.0, 80.0, 30.0, 10.0 
Tyler Zeller, C, BOS, 3500.00, 5, 8.88, 12.8, 5.61, 12.15, 60.0, 60.0, 0.0, 0.0, 0.0 
Evan Fournier, SF, ORL, 5400.00, 10, 22.8, 29.4, 18.1, 27.5, 100.0, 90.0, 50.0, 30.0, 0.0 
Andrew Nicholson, PF, ORL, 4300.00, 9, 22.16, 29.6, 15.15, 29.16, 88.89, 88.89, 88.89, 66.67, 22.22 
Nazr Mohammed, C, OKC, 3500.00, 2, 2.7, 3.4, 2, 3.4, 0.0, 0.0, 0.0, 0.0, 0.0 
Robert Sacre, C, LAL, 3500.00, 2, 9.2, 9.8, 8.6, 9.8, 100.0, 0.0, 0.0, 0.0, 0.0 
Kyle O'Quinn, C, NYK, 3500.00, 6, 10.62, 17.5, 5.39, 15.85, 66.67, 50.0, 33.33, 16.67, 0.0 
Jae Crowder, SF, BOS, 6200.00, 2, 36.5, 42, 31, 42, 100.0, 100.0, 100.0, 100.0, 50.0 
Jeremy Lamb, SG, CHA, 3500.00, 8, 14.6, 24.5, 7.34, 21.86, 75.0, 50.0, 37.5, 37.5, 37.5 
Brian Roberts, PG, POR, 3500.00, 8, 3.13, 9.2, 0.23, 6.02, 12.5, 0.0, 0.0, 0.0, 0.0 
Metta World Peace, SF, LAL, 3500.00, 6, 13.05, 29.5, 4.93, 21.17, 66.67, 66.67, 33.33, 16.67, 16.67 
Pablo Prigioni, PG, LAC, 3500.00, 9, 9.56, 15.5, 4.83, 14.3, 55.56, 44.44, 22.22, 0.0, 0.0 
Luc Richard Mbah a Moute, SF, LAC, 3500.00, 10, 7.72, 15.7, 3.41, 12.03, 40.0, 30.0, 20.0, 0.0, 0.0 
Garrett Temple, SG, WAS, 3500.00, 10, 11.73, 23.5, 5.22, 18.25, 60.0, 40.0, 30.0, 20.0, 10.0 
Jared Sullinger, PF, BOS, 5600.00, 9, 22.08, 39.9, 11.28, 32.87, 77.78, 55.56, 55.56, 33.33, 22.22 
Patrick Beverley, PG, HOU, 5200.00, 9, 24.69, 40, 14.15, 35.23, 100.0, 66.67, 55.56, 44.44, 44.44 
Aron Baynes, C, DET, 3500.00, 10, 17.27, 32.9, 8.45, 26.09, 90.0, 70.0, 70.0, 50.0, 40.0 
Henry Sims, C, BKN, 4000.00, 9, 13.67, 22.6, 7.56, 19.77, 88.89, 55.56, 22.22, 22.22, 0.0 
Mason Plumlee, C, POR, 5300.00, 11, 27.4, 42.8, 19.05, 35.75, 100.0, 90.91, 90.91, 45.45, 27.27 
Victor Oladipo, SG, ORL, 8400.00, 8, 40.68, 62.5, 30.69, 50.66, 100.0, 100.0, 75.0, 50.0, 12.5 
Cody Zeller, C, CHA, 4800.00, 10, 22.07, 33.2, 14.8, 29.34, 100.0, 80.0, 70.0, 40.0, 30.0 
Matthew Dellavedova, PG, CLE, 3600.00, 11, 13.15, 24.1, 7.1, 19.19, 81.82, 45.45, 36.36, 27.27, 18.18 
Kelly Olynyk, C, BOS, 3500.00, 9, 13.42, 35, 4.59, 22.25, 66.67, 66.67, 33.33, 22.22, 11.11 
Jorge Gutierrez, PG, CHA, 3500.00, 3, 5.73, 10, 2.26, 9.2, 33.33, 0.0, 0.0, 0.0, 0.0 
Steven Adams, C, OKC, 4600.00, 10, 21.62, 32.7, 15.81, 27.43, 90.0, 90.0, 80.0, 50.0, 10.0 
Andre Roberson, SG, OKC, 3500.00, 10, 11.39, 16.8, 8.28, 14.5, 100.0, 60.0, 30.0, 0.0, 0.0 
Solomon Hill, SG, IND, 3500.00, 9, 10.21, 25.4, 2.64, 17.78, 44.44, 33.33, 33.33, 11.11, 11.11 
Kentavious Caldwell-Pope, SG, DET, 5400.00, 9, 24.84, 37.4, 17.08, 32.59, 88.89, 77.78, 55.56, 22.22, 22.22 
Sergey Karasev, SF, BKN, 3500.00, 7, 15.13, 32.4, 6.11, 24.15, 85.71, 57.14, 42.86, 28.57, 28.57 
Dewayne Dedmon, C, ORL, 3700.00, 10, 17.36, 34.6, 10.49, 24.23, 100.0, 80.0, 70.0, 30.0, 20.0 
Willie Reed, PF, BKN, 3800.00, 4, 16.15, 23.2, 11.19, 21.11, 100.0, 75.0, 50.0, 25.0, 25.0 
Reggie Bullock, SF, DET, 3500.00, 4, 7.63, 11.9, 3.48, 11.79, 50.0, 25.0, 0.0, 0.0, 0.0 
Moe Harkless, SF, POR, 4400.00, 11, 22.16, 44.2, 11.21, 33.11, 81.82, 81.82, 72.73, 63.64, 27.27 
Allen Crabbe, SG, POR, 3500.00, 11, 14.61, 30.3, 5.95, 23.27, 72.73, 54.55, 45.45, 27.27, 27.27 
Shane Larkin, PG, BKN, 4500.00, 10, 22.43, 31, 16.72, 28.14, 100.0, 90.0, 80.0, 50.0, 20.0 
Otto Porter, SF, WAS, 5400.00, 10, 25.91, 38.5, 20.11, 31.71, 100.0, 100.0, 70.0, 30.0, 20.0 
Alexis Ajinca, C, NOP, 4300.00, 9, 19.92, 32.8, 9.29, 30.56, 77.78, 77.78, 77.78, 44.44, 33.33 
C.J. McCollum, SG, POR, 6900.00, 11, 34.04, 44.9, 26.03, 42.04, 100.0, 100.0, 72.73, 63.64, 9.09 
Nene Hilario, PF, WAS, 3900.00, 10, 17.35, 31.6, 10.73, 23.97, 90.0, 80.0, 70.0, 20.0, 10.0 
Sasha Vujacic, SG, NYK, 3700.00, 10, 14.58, 30.1, 8.09, 21.07, 90.0, 80.0, 50.0, 10.0, 10.0 
Troy Daniels, SG, CHA, 3500.00, 5, 4.72, 7, 3.09, 6.35, 20.0, 0.0, 0.0, 0.0, 0.0 
Dwight Powell, PF, DAL, 3500.00, 7, 16.26, 30.4, 5.9, 26.62, 57.14, 42.86, 42.86, 42.86, 28.57 
Marcus Smart, PG, BOS, 4300.00, 9, 19.02, 29.5, 11.51, 26.54, 88.89, 77.78, 66.67, 44.44, 22.22 
Markel Brown, SG, BKN, 3800.00, 9, 14.09, 26.3, 6.13, 22.05, 66.67, 44.44, 44.44, 44.44, 11.11 
Bojan Bogdanovic, SF, BKN, 4500.00, 8, 19.59, 38.1, 9.98, 29.19, 75.0, 62.5, 62.5, 37.5, 12.5 
Cleanthony Early, SF, NYK, 3500.00, 2, 10.7, 15.7, 5.7, 15.7, 50.0, 50.0, 50.0, 0.0, 0.0 
K.J. McDaniels, SF, HOU, 3500.00, 7, 5.07, 16.3, -0.22, 10.35, 14.29, 14.29, 14.29, 0.0, 0.0 
Spencer Dinwiddie, PG, DET, 3500.00, 1, 2.7, 2.7, 2.7, 2.7, 0.0, 0.0, 0.0, 0.0, 0.0 
Shayne Whittington, C, IND, 3500.00, 1, 0, 0, 0, 0, 0.0, 0.0, 0.0, 0.0, 0.0 
Noah Vonleh, PF, POR, 3500.00, 11, 7.45, 15.7, 2.91, 11.98, 45.45, 27.27, 18.18, 0.0, 0.0 
Shabazz Napier, PG, ORL, 3500.00, 4, 4.75, 8.4, 2.26, 7.24, 25.0, 0.0, 0.0, 0.0, 0.0 
James Ennis, SF, NOP, 3900.00, 4, 22.38, 30.6, 16.15, 28.6, 100.0, 100.0, 75.0, 75.0, 50.0 
Aaron Gordon, PF, ORL, 5700.00, 10, 24.11, 34.5, 17.14, 31.08, 100.0, 80.0, 60.0, 30.0, 10.0 
Elfrid Payton, PG, ORL, 5800.00, 9, 28.23, 48, 17.82, 38.65, 88.89, 88.89, 77.78, 33.33, 22.22 
Devyn Marble, SG, ORL, 3500.00, 8, 6.02, 16.4, 1.15, 10.88, 12.5, 12.5, 12.5, 0.0, 0.0 
J.J. Barea, PG, DAL, 5900.00, 9, 29.24, 40.5, 20.74, 37.74, 100.0, 88.89, 77.78, 55.56, 22.22 
Tarik Black, C, LAL, 3500.00, 6, 9.42, 17.2, 3.96, 14.87, 66.67, 66.67, 16.67, 0.0, 0.0 
Clint Capela, PF, HOU, 4200.00, 9, 19.84, 28.2, 13.86, 25.83, 100.0, 77.78, 66.67, 44.44, 22.22 
Jeff Ayres, PF, LAC, 3500.00, 7, 4.05, 8.3, 1.9, 6.2, 14.29, 0.0, 0.0, 0.0, 0.0 
Glenn Robinson, SF, IND, 3500.00, 1, -1, -1, -1, -1, 0.0, 0.0, 0.0, 0.0, 0.0 
Mitch McGary, PF, OKC, 3500.00, 1, 5.2, 5.2, 5.2, 5.2, 0.0, 0.0, 0.0, 0.0, 0.0 
C.J. Wilcox, SG, LAC, 3500.00, 5, 5.2, 8.5, 3.14, 7.26, 20.0, 0.0, 0.0, 0.0, 0.0 
Jordan Clarkson, SG, LAL, 5600.00, 9, 22.96, 36.7, 14.03, 31.88, 88.89, 66.67, 55.56, 44.44, 11.11 
Julius Randle, PF, LAL, 6600.00, 9, 29.22, 49.6, 15.08, 43.36, 77.78, 77.78, 66.67, 55.56, 22.22 
Langston Galloway, SG, NYK, 4000.00, 10, 19.17, 36.7, 10.22, 28.12, 90.0, 70.0, 50.0, 50.0, 40.0 
Tim Frazier, PG, NOP, 5000.00, 11, 28.23, 46.9, 19.44, 37.02, 100.0, 100.0, 72.73, 63.64, 45.45 
Jarell Eddie, SG, WAS, 3500.00, 1, 2, 2, 2, 2, 0.0, 0.0, 0.0, 0.0, 0.0 
Jordan McRae, SG, CLE, 3500.00, 6, 4.28, 5.6, 3.21, 5.34, 0.0, 0.0, 0.0, 0.0, 0.0 
Sean Kilpatrick, SG, BKN, 3700.00, 10, 17.29, 30.9, 11.59, 22.99, 100.0, 90.0, 70.0, 20.0, 20.0 
Josh Smith, PF, HOU, 3500.00, 1, 4, 4, 4, 4, 0.0, 0.0, 0.0, 0.0, 0.0 
Jordan Mickey, PF, BOS, 3500.00, 2, 4.4, 6.8, 2, 6.8, 0.0, 0.0, 0.0, 0.0, 0.0 
Terry Rozier, PG, BOS, 3600.00, 8, 9.74, 20.9, 3.76, 15.71, 50.0, 25.0, 25.0, 25.0, 0.0 
R.J. Hunter, SG, BOS, 3500.00, 2, 6.5, 6.5, 6.5, 6.5, 0.0, 0.0, 0.0, 0.0, 0.0 
Chris McCullough, PF, BKN, 3800.00, 8, 12.38, 20.7, 7.87, 16.88, 87.5, 50.0, 25.0, 12.5, 0.0 
Rondae Hollis-Jefferson, SF, BKN, 3800.00, 6, 14.25, 27.4, 7.85, 20.65, 83.33, 66.67, 33.33, 16.67, 16.67 
Kristaps Porzingis, PF, NYK, 6900.00, 7, 31.56, 40, 23.54, 39.58, 100.0, 85.71, 71.43, 42.86, 0.0 
Jerian Grant, PG, NYK, 3600.00, 10, 11.52, 23.6, 3.05, 19.99, 60.0, 50.0, 50.0, 40.0, 10.0 
Stanley Johnson, SF, DET, 3500.00, 10, 12.04, 35.4, 2.73, 21.35, 80.0, 30.0, 20.0, 20.0, 20.0 
Darrun Hilliard, SG, DET, 3500.00, 4, 12.67, 23.7, 3.48, 21.86, 50.0, 50.0, 25.0, 25.0, 25.0 
Myles Turner, PF, IND, 5400.00, 10, 22.99, 47.7, 13.18, 32.8, 90.0, 80.0, 50.0, 10.0, 10.0 
Joseph Young, SG, IND, 3500.00, 2, 0.95, 2.9, -1, 2.9, 0.0, 0.0, 0.0, 0.0, 0.0 
Frank Kaminsky, PF, CHA, 3500.00, 10, 12.36, 26.9, 5.76, 18.96, 80.0, 50.0, 40.0, 20.0, 10.0 
Mario Hezonja, SF, ORL, 3500.00, 10, 11.47, 22.1, 6.4, 16.54, 80.0, 60.0, 30.0, 10.0, 10.0 
Kelly Oubre, SF, WAS, 3500.00, 5, 4.83, 7.2, 3.04, 6.61, 20.0, 0.0, 0.0, 0.0, 0.0 
Justin Anderson, SF, DAL, 4000.00, 9, 17.15, 26.5, 8.5, 25.8, 66.67, 66.67, 55.56, 44.44, 22.22 
Pat Connaughton, SG, POR, 3500.00, 3, 0.1, 1.2, -1, 1.2, 0.0, 0.0, 0.0, 0.0, 0.0 
Cameron Payne, PG, OKC, 3500.00, 8, 6.19, 9.7, 3.62, 8.75, 50.0, 0.0, 0.0, 0.0, 0.0 
Larry Nance, PF, LAL, 3700.00, 6, 16.78, 26.9, 11.62, 21.95, 100.0, 100.0, 66.67, 33.33, 16.67 
D'Angelo Russell, PG, LAL, 5400.00, 9, 17.42, 32.6, 8.37, 26.47, 77.78, 55.56, 44.44, 11.11, 11.11 
Cliff Alexander, PF, POR, 3500.00, 1, 0, 0, 0, 0, 0.0, 0.0, 0.0, 0.0, 0.0 
Sasha Kaun, C, CLE, 3500.00, 3, 5.45, 9.9, 1, 9.9, 33.33, 0.0, 0.0, 0.0, 0.0 
Salah Mejri, C, DAL, 4100.00, 7, 20.18, 43.3, 7.37, 33, 71.43, 42.86, 42.86, 28.57, 28.57 
Luis Montero, SF, POR, 3500.00, 3, 0.6, 2.2, -1, 2.2, 0.0, 0.0, 0.0, 0.0, 0.0 
Josh Huestis, SF, OKC, 3500.00, 2, 5.1, 8.2, 2, 8.2, 50.0, 0.0, 0.0, 0.0, 0.0 
Marcelo Huertas, PG, LAL, 3500.00, 9, 13.49, 24.6, 8.42, 18.56, 100.0, 66.67, 33.33, 22.22, 11.11 
